{"meta":{"id":"bw_verification_f0ae437158f639f7","schemaVersion":"boreal.runtime.v1","createdAt":"2026-07-01T20:38:44.528Z","updatedAt":"2026-07-01T20:38:44.528Z","createdBy":{"id":"cybertron","kind":"human","displayName":"cybertron"},"updatedBy":{"id":"cybertron","kind":"human","displayName":"cybertron"},"sourceRefs":[],"tags":[],"contentHash":"sha256:36bfffbfa8309d8343b1f687458cd69451cd7c149a2e3b7f422a59f3dc61ac60"},"subjectId":"bw_work_02587a58d96dd33a","subjectType":"work","verdict":"passed","evidenceIds":["bw_evidence_529e71bd8bd327c1"],"verifiedAt":"2026-07-01T20:38:44.528Z"}
