{"meta":{"id":"bw_verification_da505e2ad9074137","schemaVersion":"boreal.runtime.v1","createdAt":"2026-07-01T20:10:23.253Z","updatedAt":"2026-07-01T20:10:23.253Z","createdBy":{"id":"cybertron","kind":"human","displayName":"cybertron"},"updatedBy":{"id":"cybertron","kind":"human","displayName":"cybertron"},"sourceRefs":[],"tags":[],"contentHash":"sha256:eee3f82d4436123b5cda56287a62f06fa0d0396f6d60277501d82eb033202fb2"},"subjectId":"bw_work_785e124dc1c7ecd4","subjectType":"work","verdict":"passed","evidenceIds":["bw_evidence_2e5edb1932af9165"],"verifiedAt":"2026-07-01T20:10:23.253Z"}
