{"meta":{"id":"bw_verification_9ebb95693bc4b144","schemaVersion":"boreal.runtime.v1","createdAt":"2026-06-27T01:27:25.931Z","updatedAt":"2026-06-27T01:27:25.931Z","createdBy":{"id":"codex-sprint01-executor","kind":"agent","displayName":"codex-sprint01-executor"},"updatedBy":{"id":"codex-sprint01-executor","kind":"agent","displayName":"codex-sprint01-executor"},"sourceRefs":[],"tags":[],"contentHash":"sha256:3205b7f0e07ee2f283a1f0b1ace50252c8b8fa48e321f4cbda64ac864a238491"},"subjectId":"bw_work_d51784f02fca54c9","subjectType":"work","verdict":"passed","evidenceIds":["bw_evidence_b2f326f1d218dc97"],"verifiedAt":"2026-06-27T01:27:25.931Z","notes":"Direct TypeScript build and focused ui-model Vitest coverage passed after implementation."}
