{"meta":{"id":"bw_verification_a50e370d50ad7fb1","schemaVersion":"boreal.runtime.v1","createdAt":"2026-07-01T21:31:20.790Z","updatedAt":"2026-07-01T21:31:20.790Z","createdBy":{"id":"cybertron","kind":"human","displayName":"cybertron"},"updatedBy":{"id":"cybertron","kind":"human","displayName":"cybertron"},"sourceRefs":[],"tags":[],"contentHash":"sha256:315466e950b4886784bfaa641c854a441ce9a03543e2fad779f9a2c0a2913116"},"subjectId":"bw_work_3c5791d07eb76647","subjectType":"work","verdict":"passed","evidenceIds":["bw_evidence_5e33868f7df88471"],"verifiedAt":"2026-07-01T21:31:20.790Z","notes":"Parent closeout verified after S04T07, S04T08, and S04T09 were closed with passing tests and checkpoint commits."}
