{"meta":{"id":"bw_verification_9b32247e9c4b1783","schemaVersion":"boreal.runtime.v1","createdAt":"2026-07-04T07:36:20.843Z","updatedAt":"2026-07-04T07:36:20.843Z","createdBy":{"id":"cybertron","kind":"human","displayName":"cybertron"},"updatedBy":{"id":"cybertron","kind":"human","displayName":"cybertron"},"sourceRefs":[],"tags":[],"contentHash":"sha256:fd7f9fcd074adf0f5715929593d0b1ab3fdb12fff5b9e92855412ef310aab33f"},"subjectId":"bw_work_25f49d2c2a07c396","subjectType":"work","verdict":"passed","evidenceIds":["bw_evidence_576cfbadbad4e1c1"],"verifiedAt":"2026-07-04T07:36:20.843Z"}
