{"meta":{"id":"bw_verification_93528b40c445dbc6","schemaVersion":"boreal.runtime.v1","createdAt":"2026-06-27T09:53:57.941Z","updatedAt":"2026-06-27T09:53:57.941Z","createdBy":{"id":"cybertron","kind":"human","displayName":"cybertron"},"updatedBy":{"id":"cybertron","kind":"human","displayName":"cybertron"},"sourceRefs":[],"tags":[],"contentHash":"sha256:c02fe2a064c35acf68d5173011282f4169fc822da95c0a1b74a80c7495b0835c"},"subjectId":"bw_work_0d8cf33353154654","subjectType":"work","verdict":"passed","evidenceIds":["bw_evidence_e807a8afaa6bc9da"],"verifiedAt":"2026-06-27T09:53:57.941Z","notes":"Focused repair-workflow test, full CLI suite, full test suite, TypeScript check, console build, diff check, sync refresh, and strict doctor all passed."}
