{"meta":{"id":"bw_verification_40c1b30b4fb59ead","schemaVersion":"boreal.runtime.v1","createdAt":"2026-06-27T00:52:50.711Z","updatedAt":"2026-06-27T00:52:50.711Z","createdBy":{"id":"cybertron","kind":"human","displayName":"cybertron"},"updatedBy":{"id":"cybertron","kind":"human","displayName":"cybertron"},"sourceRefs":[],"tags":[],"contentHash":"sha256:10299552f7ec86394d4ace73e928dede45386fba852f33cc575e8e8633fb67b1"},"subjectId":"bw_work_ae3fccec127caea8","subjectType":"work","verdict":"passed","evidenceIds":["bw_evidence_7f508cf8458d5afa"],"verifiedAt":"2026-06-27T00:52:50.711Z"}
