{"meta":{"id":"bw_verification_b1514820e86b7ece","schemaVersion":"boreal.runtime.v1","createdAt":"2026-07-04T07:48:32.094Z","updatedAt":"2026-07-04T07:48:32.094Z","createdBy":{"id":"cybertron","kind":"human","displayName":"cybertron"},"updatedBy":{"id":"cybertron","kind":"human","displayName":"cybertron"},"sourceRefs":[],"tags":[],"contentHash":"sha256:0106aa2271ab8fd4494a7485fd846cbd208f5d0e38b9b05d0d45a0424109ff68"},"subjectId":"bw_work_3992f6f5f1027854","subjectType":"work","verdict":"passed","evidenceIds":["bw_evidence_8fc1190f5a026675"],"verifiedAt":"2026-07-04T07:48:32.094Z"}
