{"meta":{"id":"bw_verification_88e689f2dcb11dbe","schemaVersion":"boreal.runtime.v1","createdAt":"2026-07-04T01:12:16.575Z","updatedAt":"2026-07-04T01:12:16.575Z","createdBy":{"id":"cybertron","kind":"human","displayName":"cybertron"},"updatedBy":{"id":"cybertron","kind":"human","displayName":"cybertron"},"sourceRefs":[],"tags":[],"contentHash":"sha256:13c9a3c36592381f8f9376f99cef3d439dd0e3ae06659b9b68a1ee56a8bee9ea"},"subjectId":"bw_work_9b9ac1a3465ac087","subjectType":"work","verdict":"passed","evidenceIds":["bw_evidence_a896f88472be48dc"],"verifiedAt":"2026-07-04T01:12:16.575Z","notes":"Verification and summary completed; git checkpoint unavailable under sandbox constraints."}
