{"meta":{"id":"bw_verification_b000554871b99865","schemaVersion":"boreal.runtime.v1","createdAt":"2026-07-01T21:17:17.718Z","updatedAt":"2026-07-01T21:17:17.718Z","createdBy":{"id":"cybertron","kind":"human","displayName":"cybertron"},"updatedBy":{"id":"cybertron","kind":"human","displayName":"cybertron"},"sourceRefs":[],"tags":[],"contentHash":"sha256:8214c816574282a7895f6c5acb72c62df881fe6461576ed8410f411d386e13ae"},"subjectId":"bw_work_f0e1357b26c16efc","subjectType":"work","verdict":"passed","evidenceIds":["bw_evidence_9c3e3572fe7b73ab"],"verifiedAt":"2026-07-01T21:17:17.718Z"}
