{"meta":{"id":"bw_verification_f9725a23a73d10b3","schemaVersion":"boreal.runtime.v1","createdAt":"2026-06-27T01:23:00.936Z","updatedAt":"2026-06-27T01:23:00.936Z","createdBy":{"id":"codex-sprint01-executor","kind":"agent","displayName":"codex-sprint01-executor"},"updatedBy":{"id":"codex-sprint01-executor","kind":"agent","displayName":"codex-sprint01-executor"},"sourceRefs":[],"tags":[],"contentHash":"sha256:d7d98ac9ee81e3f5e240935d0c7fca90c958a5ea7ea86e1f5a188494275ea8a1"},"subjectId":"bw_work_ac64e106359041e5","subjectType":"work","verdict":"passed","evidenceIds":["bw_evidence_0ae0122e7a3f7be2"],"verifiedAt":"2026-06-27T01:23:00.936Z","notes":"All Phase 01A child tasks are closed with evidence and the phase output is reflected in docs/product/V1_REMAINDER_BASELINE.md."}
