{"meta":{"id":"bw_verification_0a0159a3c5405f4b","schemaVersion":"boreal.runtime.v1","createdAt":"2026-07-02T23:04:27.339Z","updatedAt":"2026-07-02T23:04:27.339Z","createdBy":{"id":"cybertron","kind":"human","displayName":"cybertron"},"updatedBy":{"id":"cybertron","kind":"human","displayName":"cybertron"},"sourceRefs":[],"tags":[],"contentHash":"sha256:ed0c8728e0e5d5a817884128a1394b10691cf422a75e6c9184c931a01b8f4fab"},"subjectId":"bw_work_d22ad76934d1175a","subjectType":"work","verdict":"passed","evidenceIds":["bw_evidence_60cb41fb4f5997fc"],"verifiedAt":"2026-07-02T23:04:27.339Z","notes":"Verification passed: pnpm check, pnpm test (38 files/366 tests), pnpm build, strict doctor; checkpoint commit 12ba9e08."}
