{"meta":{"id":"bw_verification_47547c26bc61228f","schemaVersion":"boreal.runtime.v1","createdAt":"2026-06-27T09:47:30.573Z","updatedAt":"2026-06-27T09:47:30.573Z","createdBy":{"id":"cybertron","kind":"human","displayName":"cybertron"},"updatedBy":{"id":"cybertron","kind":"human","displayName":"cybertron"},"sourceRefs":[],"tags":[],"contentHash":"sha256:a4a123f250b01a943e48e99b4c8e94f150cc2b675d0694a85e988139629274b8"},"subjectId":"bw_work_b89f76d2d1eb1590","subjectType":"work","verdict":"passed","evidenceIds":["bw_evidence_c09e8b9f04344e0e"],"verifiedAt":"2026-06-27T09:47:30.573Z","notes":"Focused wiki-link CLI test, full CLI suite, full test suite, TypeScript check, console build, diff check, sync refresh, and strict doctor all passed."}
