{"meta":{"id":"bw_verification_5162c500497f6844","schemaVersion":"boreal.runtime.v1","createdAt":"2026-06-27T04:56:34.671Z","updatedAt":"2026-06-27T04:56:34.671Z","createdBy":{"id":"cybertron","kind":"human","displayName":"cybertron"},"updatedBy":{"id":"cybertron","kind":"human","displayName":"cybertron"},"sourceRefs":[],"tags":[],"contentHash":"sha256:3d26290f0e996cc907935dfd92a88dfa4bca0f306056c4ccfd10c0a4fc953588"},"subjectId":"bw_work_4bb812557402998a","subjectType":"work","verdict":"passed","evidenceIds":["bw_evidence_cadd443f5113b6d8"],"verifiedAt":"2026-06-27T04:56:34.671Z","notes":"Global health findings retain project/workspace/source paths, mutating repair actions are scoped with --workspace or git -C and marked confirmation-required, and browser smoke passed with no console errors or horizontal overflow."}
