{"meta":{"id":"bw_verification_a0d20097d0c19e5a","schemaVersion":"boreal.runtime.v1","createdAt":"2026-07-01T05:09:08.364Z","updatedAt":"2026-07-01T05:09:08.364Z","createdBy":{"id":"cybertron","kind":"human","displayName":"cybertron"},"updatedBy":{"id":"cybertron","kind":"human","displayName":"cybertron"},"sourceRefs":[],"tags":[],"contentHash":"sha256:50879486a39691b713beb57044ccfd4d9de1f87c34e43f1355b788ecc21e742f"},"subjectId":"bw_work_c30813a1edb7a49f","subjectType":"work","verdict":"passed","evidenceIds":["bw_evidence_a526740e30273c1e"],"verifiedAt":"2026-07-01T05:09:08.364Z","notes":"Focused validation passed. Full pnpm exec tsc -b --pretty false remains blocked by pre-existing console WorkItemView.requiredCloseoutGates errors outside this task."}
