{"meta":{"id":"bw_verification_bebe458cac607944","schemaVersion":"boreal.runtime.v1","createdAt":"2026-06-27T01:33:37.554Z","updatedAt":"2026-06-27T01:33:37.554Z","createdBy":{"id":"codex-sprint02-executor","kind":"agent","displayName":"codex-sprint02-executor"},"updatedBy":{"id":"codex-sprint02-executor","kind":"agent","displayName":"codex-sprint02-executor"},"sourceRefs":[],"tags":[],"contentHash":"sha256:962992b8f7bb245e11141bb18a02927654726d44dd08ac1389cd2d4622013fe8"},"subjectId":"bw_work_42c24f9cf68b0cf1","subjectType":"work","verdict":"passed","evidenceIds":["bw_evidence_267997d9953e22cd"],"verifiedAt":"2026-06-27T01:33:37.554Z","notes":"Task acceptance criteria reviewed before closeout."}
