{"meta":{"id":"bw_verification_32953b052ee5e247","schemaVersion":"boreal.runtime.v1","createdAt":"2026-07-01T22:12:21.618Z","updatedAt":"2026-07-01T22:12:21.618Z","createdBy":{"id":"cybertron","kind":"human","displayName":"cybertron"},"updatedBy":{"id":"cybertron","kind":"human","displayName":"cybertron"},"sourceRefs":[],"tags":[],"contentHash":"sha256:6be8453b45c43218bbd242d1c0964922d6e4fecd42909e3576e3b4a3fac44a19"},"subjectId":"bw_work_f5945533bc62b4d1","subjectType":"work","verdict":"passed","evidenceIds":["bw_evidence_933a9b7a377ae82d"],"verifiedAt":"2026-07-01T22:12:21.618Z"}
