{"meta":{"id":"bw_verification_2b80d382936816e8","schemaVersion":"boreal.runtime.v1","createdAt":"2026-07-02T16:44:32.847Z","updatedAt":"2026-07-02T16:44:32.847Z","createdBy":{"id":"cybertron","kind":"human","displayName":"cybertron"},"updatedBy":{"id":"cybertron","kind":"human","displayName":"cybertron"},"sourceRefs":[],"tags":[],"contentHash":"sha256:55de2cddfa0d54419c29fa74f1b934abba7773d8103ecbb3527925a07edc304a"},"subjectId":"bw_work_dd093b45cbb7a17a","subjectType":"work","verdict":"passed","evidenceIds":["bw_evidence_15952a148012927f","bw_evidence_efbfbbe8db949ff7"],"verifiedAt":"2026-07-02T16:44:32.847Z","notes":"Gap inversion evidence and review evidence both satisfy the closeout gates; old snapshot inference helpers were removed and tests passed."}
