{"meta":{"id":"bw_verification_f6583b77284fe987","schemaVersion":"boreal.runtime.v1","createdAt":"2026-07-13T06:07:01.914Z","updatedAt":"2026-07-13T06:07:01.914Z","createdBy":{"id":"cybertron","kind":"human","displayName":"cybertron"},"updatedBy":{"id":"cybertron","kind":"human","displayName":"cybertron"},"sourceRefs":[],"tags":[],"contentHash":"sha256:d6b8796b16918bf06cb1246673fc2a863dec2127c7e142d8edf43afb60bc5d81"},"subjectId":"bw_work_f9e21f5ba759eeb2","subjectType":"work","verdict":"passed","evidenceIds":["bw_evidence_7c024c1bedbaead0","bw_evidence_96737d4b6ed1ca86"],"verifiedAt":"2026-07-13T06:07:01.914Z","notes":"Sprint auto-report verified sync and doctor closeout evidence."}
