{"meta":{"id":"bw_verification_e5ecdf2ef7c55d44","schemaVersion":"boreal.runtime.v1","createdAt":"2026-07-01T17:21:23.564Z","updatedAt":"2026-07-01T17:21:23.564Z","createdBy":{"id":"cybertron","kind":"human","displayName":"cybertron"},"updatedBy":{"id":"cybertron","kind":"human","displayName":"cybertron"},"sourceRefs":[],"tags":[],"contentHash":"sha256:ca2843c0dbf34c108bf924e49815c3bca4aaf54d6603beed09824d7ee84473b4"},"subjectId":"bw_work_9fff3f7de3cff52d","subjectType":"work","verdict":"passed","evidenceIds":["bw_evidence_49201f8a00f3ad67"],"verifiedAt":"2026-07-01T17:21:23.564Z","notes":"Phase 03A is complete: child tasks S03T01/S03T02/S03T03 are closed, compatibility and spooling gates passed in child verifications, and strict doctor was green before closeout."}
