{"meta":{"id":"bw_verification_fd9122517428c682","schemaVersion":"boreal.runtime.v1","createdAt":"2026-07-02T00:17:44.476Z","updatedAt":"2026-07-02T00:17:44.476Z","createdBy":{"id":"cybertron","kind":"human","displayName":"cybertron"},"updatedBy":{"id":"cybertron","kind":"human","displayName":"cybertron"},"sourceRefs":[],"tags":[],"contentHash":"sha256:a347fcc791f6690bf147d2ecdbbf2d592d1041c91e2b58cb2ba8826aff567e26"},"subjectId":"bw_work_7b9e5a7e6ba14620","subjectType":"work","verdict":"passed","evidenceIds":["bw_evidence_3ef554d07db9a2bc","bw_evidence_461159baa7f19924","bw_evidence_4aa06dadb7a76649","bw_evidence_5192296f107e4400","bw_evidence_d138a9b4aefed37d"],"verifiedAt":"2026-07-02T00:17:44.476Z","notes":"Sprint 05 verified from sprint-level review, audit, sync, doctor, and checkpoint evidence; all 64 descendants are complete with no unresolved sprint work."}
