{"meta":{"id":"bw_verification_683ee10900d80531","schemaVersion":"boreal.runtime.v1","createdAt":"2026-06-27T02:20:06.737Z","updatedAt":"2026-06-27T02:20:06.737Z","createdBy":{"id":"codex-sprint03-executor","kind":"agent","displayName":"codex-sprint03-executor"},"updatedBy":{"id":"codex-sprint03-executor","kind":"agent","displayName":"codex-sprint03-executor"},"sourceRefs":[],"tags":[],"contentHash":"sha256:01d2f24fd7b91ab11f74717b6f7a81bfa547afc662709459187aa4ddd9908ee2"},"subjectId":"bw_work_2fa2ba0e21589d1b","subjectType":"work","verdict":"passed","evidenceIds":["bw_evidence_4874898f87faaca4"],"verifiedAt":"2026-06-27T02:20:06.737Z","notes":"Verification: node node_modules/typescript/bin/tsc -b --pretty false; vitest ui-model + console-components tests passed."}
