{"meta":{"id":"bw_verification_8f8c0337b431f967","schemaVersion":"boreal.runtime.v1","createdAt":"2026-07-02T23:04:10.479Z","updatedAt":"2026-07-02T23:04:10.479Z","createdBy":{"id":"cybertron","kind":"human","displayName":"cybertron"},"updatedBy":{"id":"cybertron","kind":"human","displayName":"cybertron"},"sourceRefs":[],"tags":[],"contentHash":"sha256:647ba44c7b3e3ef947efcf730556d1eab5caaf1b3d5b667a682c7cef16b1c6c8"},"subjectId":"bw_work_3c6deb91deadcf44","subjectType":"work","verdict":"passed","evidenceIds":["bw_evidence_aceb80f496f73c1c"],"verifiedAt":"2026-07-02T23:04:10.479Z","notes":"Verification passed: pnpm check, pnpm test (38 files/366 tests), pnpm build, strict doctor; checkpoint commit 12ba9e08."}
