{"meta":{"id":"bw_verification_2dc01e019e0a31ec","schemaVersion":"boreal.runtime.v1","createdAt":"2026-07-04T06:59:44.662Z","updatedAt":"2026-07-04T06:59:44.662Z","createdBy":{"id":"cybertron","kind":"human","displayName":"cybertron"},"updatedBy":{"id":"cybertron","kind":"human","displayName":"cybertron"},"sourceRefs":[],"tags":[],"contentHash":"sha256:1d41b548e819c2d039e890b173ace9c593f9c180f9dde86789fdb1725978ba65"},"subjectId":"bw_work_fac43657d420760d","subjectType":"work","verdict":"passed","evidenceIds":["bw_evidence_25a8eb219e2c8db9"],"verifiedAt":"2026-07-04T06:59:44.662Z","notes":"Passed pnpm check, representative JSON envelope budget test, registered command surface test, CLI docs group test, output spooling tests, focused directive tests, workflow-docs, git diff --check, and strict doctor. The earlier full cli.test run still has one unrelated pre-existing lock dashboard text assertion around State lock versus Runtime locks."}
